cluster,category,over_represented_pvalue,under_represented_pvalue,numDEInCat,numInCat,term,ontology,over_represented_padjust,Term,Definition
3,GO:0009407,2.0686130136060393e-10,0.9999999999832772,15,67,toxin catabolic process,BP,1.4918901952429096e-7,toxin catabolic process,"The chemical reactions and pathways resulting in the breakdown of toxin, a poisonous compound (typically a protein) that is produced by cells or organisms and that can cause disease when introduced into the body or tissues of an organism."
3,GO:0009751,2.3624547826491046e-10,1,35,347,response to salicylic acid,BP,1.4918901952429096e-7,response to salicylic acid,"Any process that results in a change in state or activity of a cell or an organism (in terms of movement, secretion, enzyme production, gene expression, etc.) as a result of a salicylic acid stimulus."
3,GO:0050832,1.6267356474989717e-8,0.9999999960196249,38,469,defense response to fungus,BP,8.805287669105148e-6,defense response to fungus,Reactions triggered in response to the presence of a fungus that act to protect the cell or organism.
3,GO:0009611,2.4251508672571854e-8,0.9999999941629062,36,419,response to wounding,BP,1.1486120795046844e-5,response to wounding,"Any process that results in a change in state or activity of a cell or an organism (in terms of movement, secretion, enzyme production, gene expression, etc.) as a result of a stimulus indicating damage to the organism."
3,GO:0042542,3.834896047764412e-8,0.9999999934745952,18,130,response to hydrogen peroxide,BP,1.6144912361088175e-5,response to hydrogen peroxide,"Any process that results in a change in state or activity of a cell or an organism (in terms of movement, secretion, enzyme production, gene expression, etc.) as a result of a hydrogen peroxide (H2O2) stimulus."
3,GO:2000022,5.334190951083818e-8,0.9999999926310167,15,89,regulation of jasmonic acid mediated signaling pathway,BP,2.0211249513656586e-5,regulation of jasmonic acid mediated signaling pathway,"Any process that modulates the frequency, rate or extent of jasmonic acid mediated signaling pathway."
3,GO:0010112,1.5316059418198594e-7,0.9999999926532352,8,22,regulation of systemic acquired resistance,BP,5.275686285050407e-5,regulation of systemic acquired resistance,"Any process that modulates the frequency, rate or extent of systemic acquired resistance."
3,GO:0019438,4.035482820112196e-7,0.999999970366353,9,33,aromatic compound biosynthetic process,BP,1.274203700450426e-4,aromatic compound biosynthetic process,"The chemical reactions and pathways resulting in the formation of aromatic compounds, any substance containing an aromatic carbon ring."
3,GO:0071456,5.120381206989743e-7,0.9999999608234948,9,35,cellular response to hypoxia,BP,1.4923941840987796e-4,cellular response to hypoxia,"Any process that results in a change in state or activity of a cell (in terms of movement, secretion, enzyme production, gene expression, etc.) as a result of a stimulus indicating lowered oxygen tension. Hypoxia, defined as a decline in O2 levels below normoxic levels of 20.8 - 20.95%, results in metabolic adaptation at both the cellular and organismal level."
3,GO:0006855,1.2312463597041644e-6,0.9999997458283941,17,130,drug transmembrane transport,BP,3.332280326370771e-4,drug transmembrane transport,The process in which a drug is transported across a membrane.
3,GO:0006355,3.834291474315538e-6,0.9999978406966109,131,2992,"regulation of transcription, DNA-templated",BP,9.685420264121048e-4,"regulation of transcription, DNA-templated","Any process that modulates the frequency, rate or extent of cellular DNA-templated transcription."
3,GO:0042343,4.107570313003184e-6,0.9999995045042264,10,52,indole glucosinolate metabolic process,BP,9.727239947480665e-4,indole glucosinolate metabolic process,"The chemical reactions and pathways resulting in the formation of indole glucosinolates. Glucosinolates are sulfur-containing compounds that have a common structure linked to an R group derived from tryptophan; indoles are biologically active substances based on 2,3-benzopyrrole, formed during the catabolism of tryptophan."
3,GO:0006032,5.524771967998774e-6,0.9999995164325222,8,35,chitin catabolic process,BP,0.001231374175691021,chitin catabolic process,"The chemical reactions and pathways resulting in the breakdown of chitin, a linear polysaccharide consisting of beta-(1->4)-linked N-acetyl-D-glucosamine residues."
3,GO:0046256,7.414613635445904e-6,0.9999999189881867,4,6,"2,4,6-trinitrotoluene catabolic process",BP,0.0014865823822777524,"2,4,6-trinitrotoluene catabolic process","The chemical reactions and pathways resulting in the breakdown of 2,4,6-trinitrotoluene, 1-methyl-2,4,6-trinitrobenzene, a highly explosive pale yellow crystalline solid."
3,GO:0019762,7.454490700257929e-6,0.9999990278954056,10,56,glucosinolate catabolic process,BP,0.0014865823822777524,glucosinolate catabolic process,"The chemical reactions and pathways resulting in the breakdown of glucosinolates, substituted thioglucosides found in rapeseed products and related cruciferae."
3,GO:0009626,8.324522615722818e-6,0.9999980978562655,16,140,plant-type hypersensitive response,BP,0.0015770808095486879,plant-type hypersensitive response,"The rapid, localized death of plant cells in response to invasion by a pathogen."
3,GO:0009627,1.1896786388977742e-5,0.9999977162170568,13,104,systemic acquired resistance,BP,0.0021406582993153556,systemic acquired resistance,The salicylic acid mediated response to a pathogen which confers broad spectrum resistance.
3,GO:0051259,1.2429264340178894e-5,0.9999992859662863,6,22,protein complex oligomerization,BP,0.0021406582993153556,protein complex oligomerization,"The process of creating protein oligomers, compounds composed of a small number, usually between three and ten, of component monomers; protein oligomers may be composed of different or identical monomers. Oligomers may be formed by the polymerization of a number of monomers or the depolymerization of a large protein polymer."
3,GO:0000272,1.7067970703777688e-5,0.9999982207694066,8,39,polysaccharide catabolic process,BP,0.0026443883394969784,polysaccharide catabolic process,"The chemical reactions and pathways resulting in the breakdown of a polysaccharide, a polymer of many (typically more than 10) monosaccharide residues linked glycosidically."
3,GO:0006979,1.7178022716734666e-5,0.9999930955930435,33,502,response to oxidative stress,BP,0.0026443883394969784,response to oxidative stress,"Any process that results in a change in state or activity of a cell or an organism (in terms of movement, secretion, enzyme production, gene expression, etc.) as a result of oxidative stress, a state often resulting from exposure to high levels of reactive oxygen species, e.g. superoxide anions, hydrogen peroxide (H2O2), and hydroxyl radicals."
3,GO:0009617,1.7447798492326327e-5,0.99999469815423,21,241,response to bacterium,BP,0.0026443883394969784,response to bacterium,"Any process that results in a change in state or activity of a cell or an organism (in terms of movement, secretion, enzyme production, gene expression, etc.) as a result of a stimulus from a bacterium."
3,GO:0045792,2.468846079325863e-5,1,3,3,negative regulation of cell size,BP,0.0035205104128373968,negative regulation of cell size,Any process that reduces cell size.
3,GO:0009696,2.5086772538033704e-5,0.999997782109828,7,31,salicylic acid metabolic process,BP,0.0035205104128373968,salicylic acid metabolic process,"The chemical reactions and pathways involving of salicylic acid (2-hydroxybenzoic acid), a derivative of benzoic acid."
3,GO:0055114,2.8088798186602624e-5,0.9999833724154286,91,1923,oxidation-reduction process,BP,0.00380101629746562,oxidation-reduction process,"A metabolic process that results in the removal or addition of one or more electrons to or from a substance, with or without the concomitant removal or addition of a proton or protons."
3,GO:0009651,4.557981271292958e-5,0.9999761944561384,55,1045,response to salt stress,BP,0.005955238288596214,response to salt stress,"Any process that results in a change in state or activity of a cell or an organism (in terms of movement, secretion, enzyme production, gene expression, etc.) as a result of a stimulus indicating an increase or decrease in the concentration of salt (particularly but not exclusively sodium and chloride ions) in the environment."
3,GO:0016998,6.897365520068497e-5,0.9999909735149747,8,49,cell wall macromolecule catabolic process,BP,0.008711372651846511,cell wall macromolecule catabolic process,The chemical reactions and pathways resulting in the breakdown of macromolecules that form part of a cell wall.
3,GO:0009625,1.7718632905477471e-4,0.9999649614394146,10,84,response to insect,BP,0.02165674196092069,response to insect,"Any process that results in a change in state or activity of a cell or an organism (in terms of movement, secretion, enzyme production, gene expression, etc.) as a result of a stimulus from an insect."
3,GO:0045893,2.159088520011759e-4,0.9999003329178892,33,570,"positive regulation of transcription, DNA-templated",BP,0.024972322327228156,"positive regulation of transcription, DNA-templated","Any process that activates or increases the frequency, rate or extent of cellular DNA-templated transcription."
3,GO:0032268,2.1749449374466328e-4,0.9999968632500283,3,5,regulation of cellular protein metabolic process,BP,0.024972322327228156,regulation of cellular protein metabolic process,"Any process that modulates the frequency, rate or extent of the chemical reactions and pathways involving a protein, occurring at the level of an individual cell."
3,GO:0009871,2.462218990878806e-4,0.9999892438568974,4,11,"jasmonic acid and ethylene-dependent systemic resistance, ethylene mediated signaling pathway",BP,0.02743925810717587,"jasmonic acid and ethylene-dependent systemic resistance, ethylene mediated signaling pathway",The series of molecular signals mediated by ethylene (ethene) involved in jasmonic acid/ethylene dependent systemic resistance.
3,GO:0009414,2.831167252725029e-4,0.9998655942908846,34,596,response to water deprivation,BP,0.03064940777307181,response to water deprivation,"Any process that results in a change in state or activity of a cell or an organism (in terms of movement, secretion, enzyme production, gene expression, etc.) as a result of a water deprivation stimulus, prolonged deprivation of water."
3,GO:0002679,3.060890131445072e-4,0.9999858293934376,4,11,respiratory burst involved in defense response,BP,0.032215868633459384,respiratory burst involved in defense response,"A phase of elevated metabolic activity, during which oxygen consumption increases made as part of a defense response ; this leads to the production, by an NADH dependent system, of hydrogen peroxide (H2O2), superoxide anions and hydroxyl radicals."
3,GO:0080142,3.1612787192051916e-4,0.9999751701168584,5,19,regulation of salicylic acid biosynthetic process,BP,0.03237320288396884,regulation of salicylic acid biosynthetic process,"Any process that modulates the frequency, rate or extent of the chemical reactions and pathways resulting in the formation of salicylic acid."
3,GO:0009644,3.385966064081658e-4,0.999919908802558,11,109,response to high light intensity,BP,0.03376164583369843,response to high light intensity,"Any process that results in a change in state or activity of a cell or an organism (in terms of movement, secretion, enzyme production, gene expression, etc.) as a result of a high light intensity stimulus."
3,GO:0000302,3.6645598791863775e-4,0.9999199404949791,10,96,response to reactive oxygen species,BP,0.03560260867240304,response to reactive oxygen species,"Any process that results in a change in state or activity of a cell or an organism (in terms of movement, secretion, enzyme production, gene expression, etc.) as a result of a reactive oxygen species stimulus. Reactive oxygen species include singlet oxygen, superoxide, and oxygen free radicals."
3,GO:0010306,4.2818392042922844e-4,0.9999770785194563,4,13,rhamnogalacturonan II biosynthetic process,BP,0.03968810332755909,rhamnogalacturonan II biosynthetic process,"The chemical reactions and pathways resulting in the formation of rhamnogalacturonan II, a low molecular mass (5 - 10KDa) pectic polysaccharide, conserved in the primary walls of dicotyledenous and monocotyledenous plants and gymnosperms."
3,GO:0009873,4.2945691117179274e-4,0.9998255077069442,23,364,ethylene-activated signaling pathway,BP,0.03968810332755909,ethylene-activated signaling pathway,"A series of molecular signals generated by the reception of ethylene (ethene, C2H4) by a receptor and ending with modulation of a cellular process, e.g. transcription."
3,GO:0031347,4.6253466364913723e-4,0.9998959377636132,10,95,regulation of defense response,BP,0.04172723429920431,regulation of defense response,"Any process that modulates the frequency, rate or extent of a defense response."
3,GO:0010248,5.377532004022101e-4,0.999987401636323,3,6,establishment or maintenance of transmembrane electrochemical gradient,BP,0.047384811077301726,establishment or maintenance of transmembrane electrochemical gradient,The directed movement of ions to establish or maintain an electrochemical gradient across a membrane by means of some agent such as a transporter or pore.
2,GO:0010167,2.5636551679852545e-8,0.9999999988617603,8,53,response to nitrate,BP,7.411838210422e-5,response to nitrate,"Any process that results in a change in state or activity of a cell or an organism (in terms of movement, secretion, enzyme production, gene expression, etc.) as a result of a nitrate stimulus."
2,GO:0071732,3.912292536512008e-8,0.9999999981674383,8,52,cellular response to nitric oxide,BP,7.411838210422e-5,cellular response to nitric oxide,"Any process that results in a change in state or activity of a cell (in terms of movement, secretion, enzyme production, gene expression, etc.) as a result of a nitric oxide stimulus."
2,GO:0009051,8.44047962720144e-8,0.9999999979882872,6,22,"pentose-phosphate shunt, oxidative branch",BP,8.904085619437456e-5,"pentose-phosphate shunt, oxidative branch","The branch of the pentose-phosphate shunt which involves the oxidation of glucose 6-P and produces ribulose 5-P, reduced NADP+ and carbon dioxide (CO2)."
2,GO:0071369,9.399932034243817e-8,0.9999999949688847,8,62,cellular response to ethylene stimulus,BP,8.904085619437456e-5,cellular response to ethylene stimulus,"Any process that results in a change in state or activity of a cell (in terms of movement, secretion, enzyme production, gene expression, etc.) as a result of an ethylene (ethene) stimulus."
2,GO:0042128,2.2016953766097097e-7,0.9999999833691737,9,81,nitrate assimilation,BP,1.5624280884163e-4,nitrate assimilation,"The nitrogen metabolic process that encompasses the uptake of nitrate from the environment and reduction to ammonia, and results in the incorporation of nitrogen derived from nitrate into cellular substances."
2,GO:0006096,2.4741537425436265e-7,0.9999999733012248,11,138,glycolytic process,BP,1.5624280884163e-4,glycolytic process,"The chemical reactions and pathways resulting in the breakdown of a carbohydrate into pyruvate, with the concomitant production of a small amount of ATP and the reduction of NAD(P) to NAD(P)H. Glycolysis begins with the metabolism of a carbohydrate to generate products that can enter the pathway and ends with the production of pyruvate. Pyruvate may be converted to acetyl-coenzyme A, ethanol, lactate, or other small molecules."
2,GO:0006094,8.56192907764674e-7,0.9999999525585447,7,52,gluconeogenesis,BP,4.634449896457643e-4,gluconeogenesis,"The formation of glucose from noncarbohydrate precursors, such as pyruvate, amino acids and glycerol."
2,GO:0071281,1.3958203782691996e-6,0.9999998910448215,8,77,cellular response to iron ion,BP,6.610954266577497e-4,cellular response to iron ion,"Any process that results in a change in state or activity of a cell (in terms of movement, secretion, enzyme production, gene expression, etc.) as a result of an iron ion stimulus."
2,GO:0009651,3.193748819246374e-6,0.9999989577046027,27,1045,response to salt stress,BP,0.0013445682529027235,response to salt stress,"Any process that results in a change in state or activity of a cell or an organism (in terms of movement, secretion, enzyme production, gene expression, etc.) as a result of a stimulus indicating an increase or decrease in the concentration of salt (particularly but not exclusively sodium and chloride ions) in the environment."
2,GO:0019676,4.699940036159328e-6,0.9999999298535337,4,10,ammonia assimilation cycle,BP,0.0017683515203535142,ammonia assimilation cycle,"The pathway by which ammonia is processed and incorporated into a cell. In an energy-rich (glucose-containing), nitrogen-poor environment, glutamine synthetase and glutamate synthase form an ammonia assimilatory cycle, in which ammonia is incorporated into L-glutamate to form L-glutamine, which then combines with alpha-ketoglutarate to regenerate L-glutamate. This ATP-dependent cycle is essential for nitrogen-limited growth and for steady-state growth with some sources of nitrogen."
2,GO:0015706,5.133773218234008e-6,0.9999997260299114,6,39,nitrate transport,BP,0.0017683515203535142,nitrate transport,"The directed movement of nitrate into, out of or within a cell, or between cells, by means of some agent such as a transporter or pore."
2,GO:0010039,7.87049698225738e-6,0.9999996955273238,5,33,response to iron ion,BP,0.002485109422147768,response to iron ion,"Any process that results in a change in state or activity of a cell or an organism (in terms of movement, secretion, enzyme production, gene expression, etc.) as a result of an iron ion stimulus."
2,GO:0006833,1.2084134395296173e-5,0.999999487116987,5,34,water transport,BP,0.0035220604018290154,water transport,"The directed movement of water (H2O) into, out of or within a cell, or between cells, by means of some agent such as a transporter or pore."
2,GO:0015760,1.3704674117627226e-5,0.9999999232329622,3,5,glucose-6-phosphate transport,BP,0.0037090721594063977,glucose-6-phosphate transport,"The directed movement of glucose-6-phosphate into, out of or within a cell, or between cells, by means of some agent such as a transporter or pore. Glucose-6-phosphate is a monophosphorylated derivative of glucose with the phosphate group attached to C-6."
2,GO:0006880,2.064987379489063e-5,0.9999994536889648,4,20,intracellular sequestering of iron ion,BP,0.005216158120589373,intracellular sequestering of iron ion,The process of binding or confining iron ions in an intracellular area such that they are separated from other components of a biological system.
2,GO:0030026,3.9099918367141394e-5,0.9999987709685256,4,21,cellular manganese ion homeostasis,BP,0.009259349418318671,cellular manganese ion homeostasis,Any process involved in the maintenance of an internal steady state of manganese ions at the level of a cell.
2,GO:0015729,4.4685641479120267e-5,0.9999995090321621,3,7,oxaloacetate transport,BP,0.009889712370775247,oxaloacetate transport,"The directed movement of oxaloacetate, the anion of oxobutanedioic acid, into, out of or within a cell, or between cells, by means of some agent such as a transporter or pore."
2,GO:0015714,4.6982006511996426e-5,0.9999994749481399,3,7,phosphoenolpyruvate transport,BP,0.009889712370775247,phosphoenolpyruvate transport,"The directed movement of phosphoenolpyruvate into, out of or within a cell, or between cells, by means of some agent such as a transporter or pore."
2,GO:0015743,4.972952646750773e-5,0.9999983961774627,4,17,malate transport,BP,0.009917114515020357,malate transport,"The directed movement of malate into, out of or within a cell, or between cells, by means of some agent such as a transporter or pore."
2,GO:0048513,5.7325977997644245e-5,0.9999992679807034,3,8,animal organ development,BP,0.010526401633135141,animal organ development,"Development of a tissue or tissues that work together to perform a specific function or functions. Development pertains to the process whose specific outcome is the progression of a structure over time, from its formation to the mature structure. Organs are commonly observed as visibly distinct structures, but may also exist as loosely associated clusters of cells that work together to perform a specific function or functions."
2,GO:0055072,5.8341101688001575e-5,0.9999949765549998,6,69,iron ion homeostasis,BP,0.010526401633135141,iron ion homeostasis,Any process involved in the maintenance of an internal steady state of iron ions within an organism or cell.
2,GO:0035436,7.558887986032474e-5,0.9999989396425424,3,8,triose phosphate transmembrane transport,BP,0.013018466626853202,triose phosphate transmembrane transport,The process in which triose phosphate (glyceraldehyde 3-phosphate) is transported across a membrane. Glyceraldehyde 3-phosphate is any organic three carbon compound phosphate ester.
2,GO:0080184,7.966973639254675e-5,0.9999998629443833,2,3,response to phenylpropanoid,BP,0.013124723095276505,response to phenylpropanoid,"Any process that results in a change in state or activity of a cell or organism (in terms of movement, secretion, enzyme production, gene expression, etc.) as the result of a phenylpropanoid stimulus. The process begins with detection of the stimulus and ends with a change in state or activity or the cell or organism. A phenylpropanoid is any of secondary metabolites with structures based on a phenylpropane skeleton. The class includes phenylpropanoid esters, flavonoids, anthocyanins, coumarins and many small phenolic molecules. Phenylpropanoids are also precursors of lignin."
2,GO:0009624,9.366648798947277e-5,0.9999843563857901,9,176,response to nematode,BP,0.014787596791338014,response to nematode,"Any process that results in a change in state or activity of a cell or an organism (in terms of movement, secretion, enzyme production, gene expression, etc.) as a result of a stimulus from a nematode."
2,GO:0015813,1.580355711082569e-4,1,2,2,L-glutamate transmembrane transport,BP,0.023103065516780836,L-glutamate transmembrane transport,The directed movement of L-glutamate across a membrane.
2,GO:0015713,1.5853251608242326e-4,0.99999689502393,3,10,phosphoglycerate transmembrane transport,BP,0.023103065516780836,phosphoglycerate transmembrane transport,"The process in which phosphoglycerate is transported across a lipid bilayer, from one side of a membrane to the other."
2,GO:0009414,1.971963805416311e-4,0.9999393558793807,16,596,response to water deprivation,BP,0.027673225402675566,response to water deprivation,"Any process that results in a change in state or activity of a cell or an organism (in terms of movement, secretion, enzyme production, gene expression, etc.) as a result of a water deprivation stimulus, prolonged deprivation of water."
2,GO:0055085,2.1540707260681325e-4,0.9999305320855915,17,562,transmembrane transport,BP,0.02914919278954341,transmembrane transport,"The process in which a solute is transported across a lipid bilayer, from one side of a membrane to the other."
2,GO:0035195,2.664054166585798e-4,0.999993343135471,3,13,gene silencing by miRNA,BP,0.03480724564549514,gene silencing by miRNA,"Downregulation of gene expression through the action of microRNAs (miRNAs), endogenous 21-24 nucleotide small RNAs processed from stem-loop RNA precursors (pre-miRNAs). Once incorporated into a RNA-induced silencing complex (RISC), miRNAs can downregulate gene expression by either of two posttranscriptional mechanisms: endolytic cleavage of mRNA cleavage or translational repression, usually accompanied by poly-A tail shortening and subsequent degradation of the mRNA."
2,GO:0071423,3.1829499042260087e-4,0.999991692251058,3,12,malate transmembrane transport,BP,0.04020065729037449,malate transmembrane transport,A process in which a malate ion is transported across a membrane.
6,GO:0006749,7.080628732275087e-12,1,13,85,glutathione metabolic process,BP,2.3350964675793845e-8,glutathione metabolic process,"The chemical reactions and pathways involving glutathione, the tripeptide glutamylcysteinylglycine, which acts as a coenzyme for some enzymes and as an antioxidant in the protection of sulfhydryl groups in enzymes and other proteins; it has a specific role in the reduction of hydrogen peroxide (H2O2) and oxidized ascorbate, and it participates in the gamma-glutamyl cycle."
6,GO:0006952,1.232566095317701e-11,1,47,1165,defense response,BP,2.3350964675793845e-8,defense response,"Reactions, triggered in response to the presence of a foreign body or the occurrence of an injury, which result in restriction of damage to the organism attacked or prevention/recovery from the infection caused by the attack."
6,GO:0009407,3.6103420379040135e-11,1,11,67,toxin catabolic process,BP,4.559861993872769e-8,toxin catabolic process,"The chemical reactions and pathways resulting in the breakdown of toxin, a poisonous compound (typically a protein) that is produced by cells or organisms and that can cause disease when introduced into the body or tissues of an organism."
6,GO:0042742,8.361608896664525e-10,1,33,726,defense response to bacterium,BP,7.920534027365472e-7,defense response to bacterium,Reactions triggered in response to the presence of a bacterium that act to protect the cell or organism.
6,GO:0009611,1.5788555463276919e-9,1,24,419,response to wounding,BP,1.1964567330071248e-6,response to wounding,"Any process that results in a change in state or activity of a cell or an organism (in terms of movement, secretion, enzyme production, gene expression, etc.) as a result of a stimulus indicating damage to the organism."
6,GO:0009695,2.883935310678234e-8,0.9999999983763669,9,47,jasmonic acid biosynthetic process,BP,1.821205148693305e-5,jasmonic acid biosynthetic process,"The chemical reactions and pathways resulting in the formation of jasmonic acid, a fatty acid derivative."
