cluster,category,over_represented_pvalue,under_represented_pvalue,numDEInCat,numInCat,term,ontology,over_represented_padjust,Term,Definition
6,GO:0055114,1.3707265555102356e-7,1,54,1923,oxidation-reduction process,BP,7.419547026897547e-5,oxidation-reduction process,"A metabolic process that results in the removal or addition of one or more electrons to or from a substance, with or without the concomitant removal or addition of a proton or protons."
6,GO:2000022,1.6244729219889175e-7,0.9999999857790541,10,89,regulation of jasmonic acid mediated signaling pathway,BP,7.69390987677001e-5,regulation of jasmonic acid mediated signaling pathway,"Any process that modulates the frequency, rate or extent of jasmonic acid mediated signaling pathway."
6,GO:0031408,3.282950842290764e-7,0.9999999798431286,8,45,oxylipin biosynthetic process,BP,1.3821223046044117e-4,oxylipin biosynthetic process,"The chemical reactions and pathways resulting in the formation of any oxylipin, any of a group of biologically active compounds formed by oxidative metabolism of polyunsaturated fatty acids."
6,GO:0006569,2.1256372637006595e-6,0.9999999796423674,4,7,tryptophan catabolic process,BP,8.054039592161798e-4,tryptophan catabolic process,"The chemical reactions and pathways resulting in the breakdown of tryptophan, the chiral amino acid 2-amino-3-(1H-indol-3-yl)propanoic acid."
6,GO:0009684,4.234686823732597e-6,0.9999998713238585,5,17,indoleacetic acid biosynthetic process,BP,0.0014586571250111643,indoleacetic acid biosynthetic process,"The chemical reactions and pathways resulting in the formation of indole-3-acetic acid, a compound which functions as a growth regulator in plants."
6,GO:0010193,4.929553150174194e-6,0.9999996409174184,7,54,response to ozone,BP,0.0015565064071675018,response to ozone,"Any process that results in a change in state or activity of a cell or an organism (in terms of movement, secretion, enzyme production, gene expression, etc.) as a result of a ozone stimulus."
6,GO:0046482,7.971173306614782e-6,0.9999998635752242,4,10,para-aminobenzoic acid metabolic process,BP,0.002323290435289493,para-aminobenzoic acid metabolic process,"The chemical reactions and pathways involving para-aminobenzoic acid, an intermediate in the synthesis of folic acid, a compound which some organisms, e.g. prokaryotes, eukaryotic microbes, and plants, can synthesize de novo. Others, notably mammals, cannot. In yeast, it is present as a factor in the B complex of vitamins."
6,GO:0009620,9.4482872362027e-6,0.9999984959889168,11,150,response to fungus,BP,0.002557111452712288,response to fungus,"Any process that results in a change in state or activity of a cell or an organism (in terms of movement, secretion, enzyme production, gene expression, etc.) as a result of a stimulus from a fungus."
6,GO:0010200,1.1862461306351234e-5,0.9999974733732847,14,286,response to chitin,BP,0.002996457725984322,response to chitin,"A process that results in a change in state or activity of a cell or an organism (in terms of movement, secretion, enzyme production, gene expression, etc.) as a result of a chitin stimulus."
6,GO:0002229,2.056446366390756e-5,0.9999968198567736,10,126,defense response to oomycetes,BP,0.004869922051409109,defense response to oomycetes,Reactions triggered in response to the presence of oomycetes that act to protect the cell or organism.
6,GO:0010120,2.974949297294015e-5,0.9999985127864399,5,27,camalexin biosynthetic process,BP,0.006630636992615896,camalexin biosynthetic process,"The chemical reactions and pathways resulting in the formation of camalexin, an indole phytoalexin."
6,GO:0018874,7.193680358247074e-5,0.9999991582185321,3,6,benzoate metabolic process,BP,0.015142697154110091,benzoate metabolic process,"The chemical reactions and pathways involving benzoate, the anion of benzoic acid (benzenecarboxylic acid), a fungistatic compound widely used as a food preservative; it is conjugated to glycine in the liver and excreted as hippuric acid."
6,GO:0009617,9.355184686066106e-5,0.9999788979737931,12,241,response to bacterium,BP,0.018656207776581304,response to bacterium,"Any process that results in a change in state or activity of a cell or an organism (in terms of movement, secretion, enzyme production, gene expression, etc.) as a result of a stimulus from a bacterium."
6,GO:0009751,1.0558138604727508e-4,0.9999723313462661,14,347,response to salicylic acid,BP,0.019336620755431532,response to salicylic acid,"Any process that results in a change in state or activity of a cell or an organism (in terms of movement, secretion, enzyme production, gene expression, etc.) as a result of a salicylic acid stimulus."
6,GO:0080185,1.0717050299922465e-4,0.9999983047111365,3,8,effector dependent induction by symbiont of host immune response,BP,0.019336620755431532,effector dependent induction by symbiont of host immune response,"Any process that involves recognition of an effector, and by which an organism activates, maintains or increases the frequency, rate or extent of the immune response of the host organism; the immune response is any immune system process that functions in the calibrated response of an organism to a potential internal or invasive threat. The host is defined as the larger of the organisms involved in a symbiotic interaction. Effectors are proteins secreted into the host cell by pathogenic microbes, presumably to alter host immune response signaling. The best characterized effectors are bacterial effectors delivered into the host cell by type III secretion system (TTSS). Effector-triggered immunity (ETI) involves the direct or indirect recognition of an effector protein by the host (for example through plant resistance or R proteins) and subsequent activation of host immune response."
6,GO:0009753,1.1568194558511934e-4,0.9999694309331011,14,338,response to jasmonic acid,BP,0.01992358599190987,response to jasmonic acid,"Any process that results in a change in state or activity of a cell or an organism (in terms of movement, secretion, enzyme production, gene expression, etc.) as a result of a jasmonic acid stimulus."
6,GO:0000162,1.2395411741884078e-4,0.9999913412591765,5,35,tryptophan biosynthetic process,BP,0.02042009351739077,tryptophan biosynthetic process,"The chemical reactions and pathways resulting in the formation of tryptophan, the chiral amino acid 2-amino-3-(1H-indol-3-yl)propanoic acid; tryptophan is synthesized from chorismate via anthranilate."
6,GO:0070212,1.3163920751417643e-4,0.9999977662186026,3,8,protein poly-ADP-ribosylation,BP,0.020782539886300605,protein poly-ADP-ribosylation,"The transfer of multiple ADP-ribose residues from NAD to a protein amino acid, forming a poly(ADP-ribose) chain."
6,GO:0031347,1.486189226569502e-4,0.9999808024762737,7,95,regulation of defense response,BP,0.022524683917887374,regulation of defense response,"Any process that modulates the frequency, rate or extent of a defense response."
6,GO:0090449,1.8423079924634566e-4,0.999996492769815,3,8,phloem glucosinolate loading,BP,0.025255293835795507,phloem glucosinolate loading,The process of loading glucosinolates into the sieve tube or companion cell of the phloem for long distance transport from source to sink.
6,GO:1901349,1.8423079924634566e-4,0.999996492769815,3,8,glucosinolate transport,BP,0.025255293835795507,glucosinolate transport,NA
6,GO:0006855,1.8663188899505783e-4,0.9999660404731575,9,130,drug transmembrane transport,BP,0.025255293835795507,drug transmembrane transport,The process in which a drug is transported across a membrane.
6,GO:0055091,2.2737599066747504e-4,1,2,2,phospholipid homeostasis,BP,0.028717587621302096,phospholipid homeostasis,Any process involved in the maintenance of an internal steady state of phospholipid within an organism or cell.
6,GO:0070328,2.2737599066747504e-4,1,2,2,triglyceride homeostasis,BP,0.028717587621302096,triglyceride homeostasis,Any process involved in the maintenance of an internal steady state of triglyceride within an organism or cell.
6,GO:0009819,2.715028642755327e-4,0.9999855529562223,4,24,drought recovery,BP,0.03318465653999979,drought recovery,"Any process that results in a change in state or activity of a cell or an organism (in terms of movement, secretion, enzyme production, gene expression, etc.) as a result of prolonged deprivation of water that restores that organism to a normal (non-stressed) condition."
6,GO:0043069,3.684095567289334e-4,0.9999782226828826,4,30,negative regulation of programmed cell death,BP,0.04362199407643527,negative regulation of programmed cell death,"Any process that stops, prevents, or reduces the frequency, rate or extent of programmed cell death, cell death resulting from activation of endogenous cellular processes."
